{
  "name": "Human Alchemist",
  "level": 2,
  "role": "Hexer",
  "organization": "Platoon",
  "type": [
    "Human",
    "Humanoid"
  ],
  "encounterValue": 8,
  "stamina": 30,
  "weaknesses": [],
  "immunities": [
    "Corruption 2",
    "Psychic 2"
  ],
  "speed": 5,
  "mobilityTraits": [],
  "size": "1M",
  "stability": 0,
  "captainBenefit": "",
  "freeStrike": 4,
  "might": -1,
  "agility": 0,
  "reason": 2,
  "intuition": 1,
  "presence": 0,
  "minion": false,
  "features": [
    {
      "featureType": "ability",
      "name": "Viscous Vial",
      "text": "",
      "type": "Main Action",
      "roll": "2d10 + 2",
      "cost": "",
      "signature": true,
      "keywords": [
        "Area",
        "Magic",
        "Ranged",
        "Weapon"
      ],
      "distance": "3 cube within 5",
      "target": "Each enemy in the area",
      "trigger": "",
      "outcomes": [
        {
          "type": "powerRoll",
          "name": "",
          "text": "",
          "tier1": "3 acid damage; A < 0 slowed (save ends)",
          "tier2": "4 acid damage; A < 1 slowed (save ends)",
          "tier3": "6 acid damage; A < 2 slowed (save ends)",
          "ordinal": 1,
          "id": "07i9wg68Uk",
          "createdAt": "2026-10-27T18:20:08.353278Z",
          "updatedAt": "2026-10-27T18:20:08.353278Z"
        }
      ],
      "ordinal": 1,
      "id": "NHDmDe3p09",
      "createdAt": "2026-10-27T18:20:08.353278Z",
      "updatedAt": "2026-10-27T18:20:08.353278Z"
    },
    {
      "featureType": "ability",
      "name": "Flash Powder",
      "text": "",
      "type": "Main Action",
      "roll": "2d10 + 2",
      "cost": "2 Malice",
      "signature": false,
      "keywords": [
        "Magic",
        "Melee",
        "Ranged",
        "Strike",
        "Weapon"
      ],
      "distance": "Melee 1 or ranged 5",
      "target": "One creature",
      "trigger": "",
      "outcomes": [
        {
          "type": "powerRoll",
          "name": "",
          "text": "",
          "tier1": "6 fire damage; I < 0 dazed (EoT)",
          "tier2": "8 fire damage; I < 1 dazed (EoT)",
          "tier3": "11 fire damage; I < 2 dazed (save ends)",
          "ordinal": 1,
          "id": "PqQcsWxgum",
          "createdAt": "2026-10-27T18:20:08.353278Z",
          "updatedAt": "2026-10-27T18:20:08.353278Z"
        }
      ],
      "ordinal": 2,
      "id": "qsnpRyESRp",
      "createdAt": "2026-10-27T18:20:08.353278Z",
      "updatedAt": "2026-10-27T18:20:08.353278Z"
    },
    {
      "featureType": "ability",
      "name": "Smoke Bomb",
      "text": "",
      "type": "Triggered Action",
      "roll": "",
      "cost": "2 Malice",
      "signature": false,
      "keywords": [
        "Area",
        "Magic",
        "Ranged"
      ],
      "distance": "1 burst",
      "target": "Self",
      "trigger": "An enemy enters a square adjacent to the alchemist",
      "outcomes": [
        {
          "type": "effect",
          "name": "Effect",
          "text": "The alchemist creates a cloud of magical fog that grants concealment, and then shifts 2. The fog lasts until the end of the encounter. While inside the fog, enemies' characteristics are considered 1 lower for the purpose of resisting potencies.",
          "tier1": "",
          "tier2": "",
          "tier3": "",
          "ordinal": 1,
          "id": "2ZgJAmtYxG",
          "createdAt": "2026-10-27T18:20:08.353278Z",
          "updatedAt": "2026-10-27T18:20:08.353278Z"
        }
      ],
      "ordinal": 3,
      "id": "kh9FWJRBhr",
      "createdAt": "2026-10-27T18:20:08.353278Z",
      "updatedAt": "2026-10-27T18:20:08.353278Z"
    },
    {
      "featureType": "trait",
      "name": "Exotic Reagents",
      "text": "The alchemist's free strikes can deal acid, cold, corruption, fire, lightning, or poison damage.",
      "type": "",
      "roll": "",
      "cost": "",
      "signature": false,
      "keywords": [],
      "distance": "",
      "target": "",
      "trigger": "",
      "outcomes": [],
      "ordinal": 4,
      "id": "05gJHDnl2H",
      "createdAt": "2026-10-27T18:20:08.353278Z",
      "updatedAt": "2026-10-27T18:20:08.353278Z"
    },
    {
      "featureType": "trait",
      "name": "Supernatural Insight",
      "text": "The alchemist ignores concealment if it's granted by a supernatural effect.",
      "type": "",
      "roll": "",
      "cost": "",
      "signature": false,
      "keywords": [],
      "distance": "",
      "target": "",
      "trigger": "",
      "outcomes": [],
      "ordinal": 5,
      "id": "OgC5iaUGoM",
      "createdAt": "2026-10-27T18:20:08.353278Z",
      "updatedAt": "2026-10-27T18:20:08.353278Z"
    }
  ],
  "monsterBand": {
    "name": "Human Alchemist",
    "description": "",
    "public": false,
    "source": "Community",
    "sections": [],
    "maliceFeatures": [],
    "monsters": [],
    "id": "yc4d5TJY93",
    "createdAt": "2026-10-27T18:20:08.353278Z",
    "updatedAt": "2026-10-27T18:20:08.353278Z"
  },
  "tokenImage": null,
  "public": false,
  "source": "Community",
  "isOwner": true,
  "id": "wPUe860M4Y",
  "createdAt": "2026-10-27T18:20:08.353278Z",
  "updatedAt": "2026-10-27T18:20:08.353278Z"
}
